{
  "$schema": "../../../../schemas/contract-deployment.schema.json",
  "schemaVersion": "1.0.0",
  "logicalName": "permissionlessSubregistries.church",
  "canonicalId": "eip155:34348/permissionlessSubregistries.church@faithchain-2026.09.0",
  "contractVersion": "1.0.0-alpha.26",
  "status": "pilot",
  "chain": {
    "caip2": "eip155:34348",
    "chainId": 34348,
    "name": "Faithchain (estate chain)"
  },
  "address": "0x65bBf8Fe17c62E711d903Dd5318F2F3Ef8f19866",
  "proxy": null,
  "source": {
    "package": "@agenticprimitives/contracts",
    "packageVersion": "1.0.0-alpha.26",
    "repository": "git+https://github.com/agentictrustlabs/agenticprimitives.git",
    "recordedFrom": "deployments-faithchain.json"
  },
  "compiler": {
    "toolchain": "foundry",
    "details": "see @agenticprimitives/contracts build metadata"
  },
  "artifacts": {
    "abi": "contracts/abis/PermissionlessSubregistry.json",
    "abiSha256": "3983221e4fc0d4698b652c2a3d65331d4b138437a829c51dc232ec38c1227ad9"
  },
  "deployment": {
    "deployer": "0x1fcd93189311bedE20a02592cC83f31199A303bF",
    "transactionHash": null,
    "blockNumber": null,
    "note": "tx/block provenance lives in the canonical deploy pipeline; this record is resolved from the published package"
  },
  "verification": {
    "runtimeCodePresent": null,
    "lastCheckedAt": null,
    "method": "not verifiable from this kit — the chain has no public RPC"
  }
}
