{
  "$schema": "../../../../schemas/contract-deployment.schema.json",
  "schemaVersion": "1.0.0",
  "logicalName": "agentRegistryBase",
  "canonicalId": "eip155:84532/agentRegistryBase@base-sepolia-2026.09.0",
  "contractVersion": "1.0.0-alpha.26",
  "status": "pilot",
  "chain": {
    "caip2": "eip155:84532",
    "chainId": 84532,
    "name": "Base Sepolia"
  },
  "address": "0xB18534CA9c679968132ca2a43E454f5fA341030D",
  "proxy": null,
  "source": {
    "package": "@agenticprimitives/contracts",
    "packageVersion": "1.0.0-alpha.26",
    "repository": "git+https://github.com/agentictrustlabs/agenticprimitives.git",
    "recordedFrom": "deployments-base-sepolia.json"
  },
  "compiler": {
    "toolchain": "foundry",
    "details": "see @agenticprimitives/contracts build metadata"
  },
  "artifacts": {
    "abi": "contracts/abis/AgentRegistryBase.json",
    "abiSha256": "187e48af93d4a9e96c8a5cbaa8f85a6d8b3416e63374f81c0f8b425074eb6513"
  },
  "deployment": {
    "deployer": "0x31ed17fb99e82E02085Ab4B3cbdaB05489098b44",
    "transactionHash": null,
    "blockNumber": null,
    "note": "tx/block provenance lives in the canonical deploy pipeline; this record is resolved from the published package"
  },
  "verification": {
    "runtimeCodePresent": null,
    "lastCheckedAt": null,
    "method": "scripts/doctor.mjs --verify-code (eth_getCode against the public RPC)"
  }
}
