{
  "$schema": "../../../../schemas/contract-deployment.schema.json",
  "schemaVersion": "1.0.0",
  "logicalName": "agentNameRegistry",
  "canonicalId": "eip155:84532/agentNameRegistry@base-sepolia-2026.09.0",
  "contractVersion": "1.0.0-alpha.26",
  "status": "pilot",
  "chain": {
    "caip2": "eip155:84532",
    "chainId": 84532,
    "name": "Base Sepolia"
  },
  "address": "0x6629Cca40B008C0984a1Ca266Ca10A344420cac3",
  "proxy": null,
  "source": {
    "package": "@agenticprimitives/contracts",
    "packageVersion": "1.0.0-alpha.26",
    "repository": "git+https://github.com/agentictrustlabs/agenticprimitives.git",
    "recordedFrom": "deployments-base-sepolia.json"
  },
  "compiler": {
    "toolchain": "foundry",
    "details": "see @agenticprimitives/contracts build metadata"
  },
  "artifacts": {
    "abi": "contracts/abis/AgentNameRegistry.json",
    "abiSha256": "848b4fec51a918943a2f6fafa93251c9a478d2b1acb009a2eaa5da16561b41bd"
  },
  "deployment": {
    "deployer": "0x31ed17fb99e82E02085Ab4B3cbdaB05489098b44",
    "transactionHash": null,
    "blockNumber": null,
    "note": "tx/block provenance lives in the canonical deploy pipeline; this record is resolved from the published package"
  },
  "verification": {
    "runtimeCodePresent": null,
    "lastCheckedAt": null,
    "method": "scripts/doctor.mjs --verify-code (eth_getCode against the public RPC)"
  }
}
