{
  "$schema": "../../../../schemas/contract-deployment.schema.json",
  "schemaVersion": "1.0.0",
  "logicalName": "agentProfileResolver",
  "canonicalId": "eip155:84532/agentProfileResolver@base-sepolia-2026.09.0",
  "contractVersion": "1.0.0-alpha.26",
  "status": "pilot",
  "chain": {
    "caip2": "eip155:84532",
    "chainId": 84532,
    "name": "Base Sepolia"
  },
  "address": "0xfcd37F8dca26ead889922b22C169c21370bd352a",
  "proxy": null,
  "source": {
    "package": "@agenticprimitives/contracts",
    "packageVersion": "1.0.0-alpha.26",
    "repository": "git+https://github.com/agentictrustlabs/agenticprimitives.git",
    "recordedFrom": "deployments-base-sepolia.json"
  },
  "compiler": {
    "toolchain": "foundry",
    "details": "see @agenticprimitives/contracts build metadata"
  },
  "artifacts": {
    "abi": "contracts/abis/AgentProfileResolver.json",
    "abiSha256": "96e6283433281c83ac60be1b77d2de1ed84a042411c186c3545870b76a127e28"
  },
  "deployment": {
    "deployer": "0x31ed17fb99e82E02085Ab4B3cbdaB05489098b44",
    "transactionHash": null,
    "blockNumber": null,
    "note": "tx/block provenance lives in the canonical deploy pipeline; this record is resolved from the published package"
  },
  "verification": {
    "runtimeCodePresent": null,
    "lastCheckedAt": null,
    "method": "scripts/doctor.mjs --verify-code (eth_getCode against the public RPC)"
  }
}
