{
  "$schema": "../../../../schemas/contract-deployment.schema.json",
  "schemaVersion": "1.0.0",
  "logicalName": "agentAccountFactory",
  "canonicalId": "eip155:34348/agentAccountFactory@faithchain-2026.09.0",
  "contractVersion": "1.0.0-alpha.26",
  "status": "pilot",
  "chain": {
    "caip2": "eip155:34348",
    "chainId": 34348,
    "name": "Faithchain (estate chain)"
  },
  "address": "0x464eEe7518c3c97DA570592481329E0627E9a3B8",
  "proxy": null,
  "source": {
    "package": "@agenticprimitives/contracts",
    "packageVersion": "1.0.0-alpha.26",
    "repository": "git+https://github.com/agentictrustlabs/agenticprimitives.git",
    "recordedFrom": "deployments-faithchain.json"
  },
  "compiler": {
    "toolchain": "foundry",
    "details": "see @agenticprimitives/contracts build metadata"
  },
  "artifacts": {
    "abi": "contracts/abis/AgentAccountFactory.json",
    "abiSha256": "b7dbf093be397d15bcfb8d28ba2f53ba3c5e5e4a5789d06b678e36679f1ccec9"
  },
  "deployment": {
    "deployer": "0x1fcd93189311bedE20a02592cC83f31199A303bF",
    "transactionHash": null,
    "blockNumber": null,
    "note": "tx/block provenance lives in the canonical deploy pipeline; this record is resolved from the published package"
  },
  "verification": {
    "runtimeCodePresent": null,
    "lastCheckedAt": null,
    "method": "not verifiable from this kit — the chain has no public RPC"
  }
}
