{
  "$schema": "../../../../schemas/contract-deployment.schema.json",
  "schemaVersion": "1.0.0",
  "logicalName": "agentNameRegistry",
  "canonicalId": "eip155:34348/agentNameRegistry@faithchain-2026.09.0",
  "contractVersion": "1.0.0-alpha.26",
  "status": "pilot",
  "chain": {
    "caip2": "eip155:34348",
    "chainId": 34348,
    "name": "Faithchain (estate chain)"
  },
  "address": "0x60E949D52660A9D4143ecB0fdA56c0457f20aED9",
  "proxy": null,
  "source": {
    "package": "@agenticprimitives/contracts",
    "packageVersion": "1.0.0-alpha.26",
    "repository": "git+https://github.com/agentictrustlabs/agenticprimitives.git",
    "recordedFrom": "deployments-faithchain.json"
  },
  "compiler": {
    "toolchain": "foundry",
    "details": "see @agenticprimitives/contracts build metadata"
  },
  "artifacts": {
    "abi": "contracts/abis/AgentNameRegistry.json",
    "abiSha256": "848b4fec51a918943a2f6fafa93251c9a478d2b1acb009a2eaa5da16561b41bd"
  },
  "deployment": {
    "deployer": "0x1fcd93189311bedE20a02592cC83f31199A303bF",
    "transactionHash": null,
    "blockNumber": null,
    "note": "tx/block provenance lives in the canonical deploy pipeline; this record is resolved from the published package"
  },
  "verification": {
    "runtimeCodePresent": null,
    "lastCheckedAt": null,
    "method": "not verifiable from this kit — the chain has no public RPC"
  }
}
