{
  "$schema": "../../../../schemas/contract-deployment.schema.json",
  "schemaVersion": "1.0.0",
  "logicalName": "permissionlessSubregistries.circle",
  "canonicalId": "eip155:84532/permissionlessSubregistries.circle@base-sepolia-2026.09.0",
  "contractVersion": "1.0.0-alpha.26",
  "status": "pilot",
  "chain": {
    "caip2": "eip155:84532",
    "chainId": 84532,
    "name": "Base Sepolia"
  },
  "address": "0xE194187c64c45803eda55BC399A4e7d39C1449A6",
  "proxy": null,
  "source": {
    "package": "@agenticprimitives/contracts",
    "packageVersion": "1.0.0-alpha.26",
    "repository": "git+https://github.com/agentictrustlabs/agenticprimitives.git",
    "recordedFrom": "deployments-base-sepolia.json"
  },
  "compiler": {
    "toolchain": "foundry",
    "details": "see @agenticprimitives/contracts build metadata"
  },
  "artifacts": {
    "abi": "contracts/abis/PermissionlessSubregistry.json",
    "abiSha256": "3983221e4fc0d4698b652c2a3d65331d4b138437a829c51dc232ec38c1227ad9"
  },
  "deployment": {
    "deployer": "0x31ed17fb99e82E02085Ab4B3cbdaB05489098b44",
    "transactionHash": null,
    "blockNumber": null,
    "note": "tx/block provenance lives in the canonical deploy pipeline; this record is resolved from the published package"
  },
  "verification": {
    "runtimeCodePresent": null,
    "lastCheckedAt": null,
    "method": "scripts/doctor.mjs --verify-code (eth_getCode against the public RPC)"
  }
}
