{
  "$schema": "../../../../schemas/contract-deployment.schema.json",
  "schemaVersion": "1.0.0",
  "logicalName": "approvedHashRegistry",
  "canonicalId": "eip155:84532/approvedHashRegistry@base-sepolia-2026.08.0",
  "contractVersion": "1.0.0-alpha.21",
  "status": "pilot",
  "chain": {
    "caip2": "eip155:84532",
    "chainId": 84532,
    "name": "Base Sepolia"
  },
  "address": "0x465f8DCE65aB51A1562CC60E6bc046ca8734D537",
  "proxy": null,
  "source": {
    "package": "@agenticprimitives/contracts",
    "packageVersion": "1.0.0-alpha.21",
    "repository": "git+https://github.com/agentictrustlabs/agenticprimitives.git",
    "recordedFrom": "deployments-base-sepolia.json"
  },
  "compiler": {
    "toolchain": "foundry",
    "details": "see @agenticprimitives/contracts build metadata"
  },
  "artifacts": {
    "abi": "contracts/abis/ApprovedHashRegistry.json",
    "abiSha256": "714f9bfadcad668ed9b73997b139bf678259fe9ce527a7ea3e5bebd64c5deae1"
  },
  "deployment": {
    "deployer": "0x31ed17fb99e82E02085Ab4B3cbdaB05489098b44",
    "transactionHash": null,
    "blockNumber": null,
    "note": "tx/block provenance lives in the canonical deploy pipeline; this record is resolved from the published package"
  },
  "verification": {
    "runtimeCodePresent": null,
    "lastCheckedAt": null,
    "method": "scripts/doctor.mjs --verify-code (eth_getCode against the public RPC)"
  }
}
