{
  "$schema": "../../../../schemas/contract-deployment.schema.json",
  "schemaVersion": "1.0.0",
  "logicalName": "geoFeatureRegistry",
  "canonicalId": "eip155:34348/geoFeatureRegistry@faithchain-2026.09.0",
  "contractVersion": "1.0.0-alpha.26",
  "status": "pilot",
  "chain": {
    "caip2": "eip155:34348",
    "chainId": 34348,
    "name": "Faithchain (estate chain)"
  },
  "address": "0x4D0B90F17148ED671CfeEc1a6DAC4ee297f521B0",
  "proxy": null,
  "source": {
    "package": "@agenticprimitives/contracts",
    "packageVersion": "1.0.0-alpha.26",
    "repository": "git+https://github.com/agentictrustlabs/agenticprimitives.git",
    "recordedFrom": "deployments-faithchain.json"
  },
  "compiler": {
    "toolchain": "foundry",
    "details": "see @agenticprimitives/contracts build metadata"
  },
  "artifacts": {
    "abi": "contracts/abis/GeoFeatureRegistry.json",
    "abiSha256": "bc5aebda6e870cb21311f5d76fb356a9ffef9f63c058c565f1c5687699f098e9"
  },
  "deployment": {
    "deployer": "0x1fcd93189311bedE20a02592cC83f31199A303bF",
    "transactionHash": null,
    "blockNumber": null,
    "note": "tx/block provenance lives in the canonical deploy pipeline; this record is resolved from the published package"
  },
  "verification": {
    "runtimeCodePresent": null,
    "lastCheckedAt": null,
    "method": "not verifiable from this kit — the chain has no public RPC"
  }
}
