{
  "$schema": "../../../../schemas/contract-deployment.schema.json",
  "schemaVersion": "1.0.0",
  "logicalName": "callDataHashEnforcer",
  "canonicalId": "eip155:34348/callDataHashEnforcer@faithchain-2026.09.0",
  "contractVersion": "1.0.0-alpha.26",
  "status": "pilot",
  "chain": {
    "caip2": "eip155:34348",
    "chainId": 34348,
    "name": "Faithchain (estate chain)"
  },
  "address": "0x142e97F9012e587330Cfe6222E01338D1A200378",
  "proxy": null,
  "source": {
    "package": "@agenticprimitives/contracts",
    "packageVersion": "1.0.0-alpha.26",
    "repository": "git+https://github.com/agentictrustlabs/agenticprimitives.git",
    "recordedFrom": "deployments-faithchain.json"
  },
  "compiler": {
    "toolchain": "foundry",
    "details": "see @agenticprimitives/contracts build metadata"
  },
  "artifacts": {
    "abi": "contracts/abis/CallDataHashEnforcer.json",
    "abiSha256": "61b766ecee830c57c5da17a7a0cd69fb6274a370d5e2ecfeb09d162fea945e65"
  },
  "deployment": {
    "deployer": "0x1fcd93189311bedE20a02592cC83f31199A303bF",
    "transactionHash": null,
    "blockNumber": null,
    "note": "tx/block provenance lives in the canonical deploy pipeline; this record is resolved from the published package"
  },
  "verification": {
    "runtimeCodePresent": null,
    "lastCheckedAt": null,
    "method": "not verifiable from this kit — the chain has no public RPC"
  }
}
